evt_052,,,Visita al PRBB y el CRG,"Visita a cargo del Dr. Reimund Fickert, responsable de Comunicación y Relaciones Institucionales del PRBB, consiste en una presentación general del PRBB como ecosistema de investigación en ciencias de la vida y la biomedicina y un breve recorrido por las instalaciones. Todo ello con una duración de 1,5 h. A su vez se presentará una exposición sobre el CRG y su relevancia en la ciencia, así como oportunidades disponibles para los estudiantes.",viveBAC,No aplica,Visita,2026/07/07,10:00:00,12:00:00,Exterior de la facultat de biociencies,Barcelona Biomedical Research Park,Español
evt_053,,,Visita guiada Barcelona,Una visita por el centro histórico de Barcelona para conocer sus más grandes monumentos y escuchar todo lo que ciudad contal tiene por contarte. ,viveBAC,No aplica,Visita,2026/07/08,16:30:00,21:45:00,Exterior de la facultat de biociencies,Casa Batlló,Español
evt_054,spk_026,Marta Figa,Descubre y lidera el ciclo de vida de un producto farmacéutico con HIPRA,"¿Te has preguntado cómo viaja una idea desde el laboratorio hasta el mercado global? En este Workshop, Marta Figa (Strategic Projects Director en HIPRA) nos abrirá las puertas de una de las multinacionales biotecnológicas de referencia en Europa. Durante la sesión, conoceremos la estructura de la compañía y exploraremos el fascinante ciclo de vida de un producto farmacéutico con ejemplos reales, profundizando en el papel fundamental de las distintas áreas en I+D de una compañía en expansión. Más allá de la teoría, esta sesión te brindará la excelente oportunidad de aprender mediante la resolución de retos reales de la industria. Trabajando en equipos, analizaréis casos prácticos donde podréis desarrollar vuestra visión estratégica y fomentar soft skills clave para vuestro futuro profesional. La actividad culminará en una mesa redonda interactiva, donde cada grupo compartirá su solución, creando un espacio ideal para el aprendizaje colaborativo y el intercambio de ideas con una directiva experta del sector.
",viveBAC,Industrial,Taller,2026/07/08,17:00:00,20:00:00,Exterior de la facultat de biociencies,HIPRA,Español
evt_055,"spk_041, spk_040, spk_038, spk_039, spk_042","Jordi Martorell, Xavier Rovira, Juan Carlos Esteban Santos, Xavier Aldeguer, Rocío Vázquez (moderadora)",Biotech Meeting Point,"El Biotech Meeting Point es un espacio de encuentro para conectar estudiantes, profesionales, empresas e instituciones del sector biotecnológico. Su objetivo es fomentar el networking, compartir oportunidades y acercar el talento joven al ecosistema biotech.",viveBAC,Biobusiness,Speed Meeting,2026/07/09,9:00:00,11:00:00,Sala de Graus,Universitat Autònoma de Barcelona,Español
evt_056,,,Visita científica por Barcelona Ramón y Cajal,Una visita por los rincones icónicos en donde la ciencia tuvo sus más grandes hitos en la capital catalana.,viveBAC,No aplica,Visita,2026/07/08,16:30:00,21:30:00,Exterior de la facultat de biociencies,"Ramon y Cajal, 40",Español
evt_073,,Federico Álvarez Villareal,Taller de cerveza artesanal con Cervesa del Montseny,"Descripción del proceso cervesero, descripcion de la empresa y su funcionamiento, y una cata final.",viveBAC,Alimentaria,Taller,2026/07/07,10:00:00,14:00:00,Exterior de la facultat de biociencies,"Cervesa del Montseny, Tap Room",Español
,,,,,,,,,,,,,
,,,,,,,,,,,,,
Enlace al excel de bioBAC,,,,,,,,,,,,,
Consultar para detalle de biografía de ponentes y descripción de las charlas,,,,,,,,,,,,,
https://docs.google.com/spreadsheets/d/1IGMyaOGp7xbIisYCaTvPvOGGvHCauyjAlml3wIk97gA/edit?usp=sharing,,,,,,,,,,,,,
,,,,,,,,,,,,,
Enlace al excel de businessBAC,,,,,,,,,,,,,